{
  "date": "2026-10-08",
  "window": "1h",
  "since": "2026-10-08T19:31:06-04:00",
  "until": "2026-10-08T20:31:07-04:00",
  "base_branch": "parkd821-20260908",
  "prior_retro_baseline": ".context/retros/2026-09-27-1.json",
  "metrics": {
    "commits": 1,
    "commits_no_merge": 1,
    "contributors": 1,
    "automation_commits": 0,
    "insertions_raw": 85,
    "deletions_raw": 5,
    "net_loc_raw": 80,
    "insertions_filtered": 85,
    "deletions_filtered": 5,
    "net_loc_filtered": 80,
    "filter_note": "git log --numstat on the verified remote branch in the stated one-hour window contains only bb1b6a5. No lockfiles or generated reports changed. Test ratio uses test insertions divided by filtered net LOC.",
    "test_loc_insertions": 63,
    "test_ratio_pct": 78.75,
    "feat_pct": 0,
    "fix_pct": 0,
    "docs_pct": 0,
    "chore_pct": 0,
    "test_pct": 100,
    "active_days": 1,
    "sessions": 1,
    "deep_sessions": 0,
    "peak_hour": 20,
    "late_night_commits_22_to_04": 0,
    "team_streak_days": 1,
    "personal_streak_days": 1,
    "backlog_open_todos": 0,
    "backlog_closed_this_period": 0,
    "version_range": ["none", "none"],
    "release_commits": 0,
    "focus_area": "Governance workflow and Graft deep-routing regression coverage"
  },
  "authors": {
    "Chris Sorensen": { "commits": 1, "role": "human", "insertions": 85, "deletions": 5 }
  },
  "note": "Session-bounded retrospective, not a weekly repository audit. Streaks count only days in this one-hour window. One observed repair session lasted less than 30 minutes at the window end. TODOS.md is absent, so backlog counters are zero. No release or tag occurred in the window; version_range uses explicit none sentinels. Excludes subsequent status and retrospective documentation commits. Prior 14-day baseline is not comparable to this window.",
  "session_focus": {
    "summary": "Repaired all three failing jobs from Governance run 37729327112 in an isolated checkout. Delivery-guard tests passed 98/98, skill documentation passed, and replacement run 37865009603 passed all five jobs on bb1b6a5.",
    "commits_this_session_range": "9fe0db92..bb1b6a59",
    "incidents": [
      "Clean CI checkout had no ignored Graft cache, so graft check failed with NO GRAPH.",
      "Local deep routing crashed under PowerShell strict mode because a dollar amount interpolated an unset variable."
    ],
    "process_learnings": [
      "Build ignored deterministic caches in clean CI checkouts before validating them; keep the validation blocking.",
      "Pair automation changes with executable regression tests in the same commit.",
      "Exercise wrapper routing and failure propagation with stubbed providers; dry-run success alone does not prove the execution path.",
      "Verify replacement CI on the pushed repair commit instead of rerunning an immutable historical failure."
    ]
  }
}
