{
  "date": "2026-07-15",
  "window": "7d",
  "since": "2026-07-15T00:00:00-04:00",
  "until": "2026-07-15",
  "base_branch": "main",
  "prior_retro_baseline": ".context/retros/2026-07-14-1.json",
  "note": "supersedes earlier same-day snapshot (105 commits) captured mid-session before concurrent session's post-seal/security-auditor/CIC-submodule work landed",
  "metrics": {
    "commits": 146,
    "commits_no_merge": 0,
    "contributors": 2,
    "automation_commits": 0,
    "insertions_raw": 75421,
    "deletions_raw": 16771,
    "net_loc_raw": 58650,
    "insertions_filtered": 89083,
    "deletions_filtered": 16525,
    "net_loc_filtered": 72558,
    "filter_note": "raw LOC excludes lockfiles (package-lock.json, yarn.lock, etc.) and auto-generated reports",
    "test_loc_insertions": 13753,
    "test_ratio_pct": 8.0,
    "feat_pct": 34.9,
    "fix_pct": 18.3,
    "docs_pct": 18.3,
    "chore_pct": 21.4,
    "test_pct": 7.1,
    "active_days": 8,
    "sessions": 0,
    "deep_sessions": 0,
    "peak_hour": 12,
    "late_night_commits_22_to_04": 43,
    "team_streak_days": 0,
    "personal_streak_days": 0,
    "backlog_open_todos": 0,
    "backlog_closed_this_period": 0,
    "version_range": [
      "v1.0.0",
      "v1.0.0"
    ],
    "release_commits": 0,
    "focus_area": "unknown"
  },
  "authors": {
    "Chris Sorensen": {
      "commits": 1,
      "role": "human"
    }
  },
  "session_focus": {
    "summary": "Routine development session",
    "incidents": [],
    "process_learnings": []
  }
}