{
  "date": "2026-07-25",
  "window": "7d",
  "since": "2026-07-25T00:00:00-04:00",
  "until": "2026-07-25T23:59:59-04:00",
  "base_branch": "main",
  "prior_retro_baseline": ".context/retros/2026-07-23-1.json",
  "note": "Initial pass (streak ended 2026-07-24; 0 commits on 07-25 as of run). Test LOC scan was un-scoped (1022 LOC); superseded by reconciled run 2026-07-25-2.json (1863 LOC canonical test pattern).",
  "metrics": {
    "commits": 140,
    "commits_no_merge": 140,
    "contributors": 2,
    "automation_commits": 23,
    "insertions_raw": 27687,
    "deletions_raw": 7267,
    "net_loc_raw": 20420,
    "insertions_filtered": 27687,
    "deletions_filtered": 7267,
    "net_loc_filtered": 20420,
    "filter_note": "raw LOC includes lockfiles and autogenerated reports; filtered excludes lockfiles",
    "test_loc_insertions": 1022,
    "test_ratio_pct": 3.7,
    "feat_pct": 26.6,
    "fix_pct": 11.5,
    "docs_pct": 36.0,
    "chore_pct": 21.6,
    "test_pct": 2.2,
    "active_days": 7,
    "sessions": 29,
    "deep_sessions": 8,
    "peak_hour": 22,
    "late_night_commits_22_to_04": 0,
    "team_streak_days": 17,
    "personal_streak_days": 17,
    "backlog_open_todos": 7,
    "backlog_closed_this_period": 0,
    "version_range": [
      "v2.8.6",
      "v2.21.0"
    ],
    "release_commits": 23,
    "focus_area": "TRM ingest pipeline (image analyzer HTTP client, PNG format detection, research-questions skill, vision-first photo judgment); CLAUDE.md/skill-doc governance updates; 21 version bumps"
  },
  "authors": {
    "Chris Sorensen": {
      "commits": 117,
      "role": "human"
    },
    "toolforge-release-bot": {
      "commits": 23,
      "role": "automation"
    }
  },
  "session_focus": {
    "summary": "TRM ingest pipeline (image analyzer HTTP client, PNG format detection, research-questions skill, vision-first photo judgment); CLAUDE.md/skill-doc governance updates; 21 version bumps",
    "incidents": [],
    "process_learnings": []
  }
}