{
  "date": "2026-10-08",
  "window": "1h",
  "since": "2026-10-08T21:11:54-04:00",
  "until": "2026-10-08T22:11:55-04:00",
  "base_branch": "codex/fix-matrix-37297242249",
  "prior_retro_baseline": ".context/retros/2026-09-27-1.json",
  "metrics": {
    "commits": 1,
    "commits_no_merge": 1,
    "contributors": 1,
    "automation_commits": 0,
    "insertions_raw": 71,
    "deletions_raw": 4,
    "net_loc_raw": 67,
    "insertions_filtered": 71,
    "deletions_filtered": 4,
    "net_loc_filtered": 67,
    "filter_note": "Commit-derived numstat for 1fb2dec in the stated window. No lockfiles or generated reports changed. Test ratio divides test insertions by filtered net LOC.",
    "test_loc_insertions": 58,
    "test_ratio_pct": 86.57,
    "feat_pct": 0,
    "fix_pct": 0,
    "docs_pct": 0,
    "chore_pct": 0,
    "test_pct": 100,
    "active_days": 1,
    "sessions": 1,
    "deep_sessions": 0,
    "peak_hour": 22,
    "late_night_commits_22_to_04": 1,
    "team_streak_days": 1,
    "personal_streak_days": 1,
    "backlog_open_todos": 0,
    "backlog_closed_this_period": 0,
    "version_range": ["none", "none"],
    "release_commits": 0,
    "focus_area": "Sigil test discovery in the Toolforge governance matrix"
  },
  "authors": {
    "Chris Sorensen": { "commits": 1, "role": "human", "insertions": 71, "deletions": 4 }
  },
  "note": "Bounded repair snapshot, not a weekly audit. Streaks count only days in this window; one observed session lasted less than 30 minutes at window end. No TODOS.md or release occurred, so backlog counters are zero and version_range uses none sentinels. Excludes subsequent evidence documentation. No trend comparison with the prior 14-day window.",
  "session_focus": {
    "summary": "Added executable regressions and fixed Sigil's matrix smoke discovery. Local delivery-guard suite passed 96/96. Matrix run 37873116744 passed all five rows; Sigil ran 1610 tests with 0 failures. PR #108 remains open against main.",
    "commits_this_session_range": "2a45dde6..1fb2dec5",
    "incidents": [
      "Copied CIC-GOVERNANCE suites entered Sigil's broad Node test discovery and expected foreign files, dependencies, and commit history."
    ],
    "process_learnings": [
      "When copying shared runtime packages into another repository, keep that repository's test discovery explicit and retain all owned test locations.",
      "Use a failing foreign suite in a disposable fixture to prove discovery exclusion, and an owned failing suite to prove the gate still blocks.",
      "Remove NODE_TEST_CONTEXT from nested Node test-runner fixtures so inherited runner state cannot suppress their execution.",
      "Verify the actual multi-repository workflow after pushing; a local fixture pass alone does not prove live matrix behavior."
    ]
  }
}
