{
  "date": "2026-07-27",
  "window": "7d",
  "since": "2026-07-27T00:00:00-04:00",
  "until": "2026-07-27T23:59:59-04:00",
  "base_branch": "main",
  "prior_retro_baseline": ".context/retros/2026-07-26-3.json",
  "note": null,
  "metrics": {
    "commits": 41,
    "commits_no_merge": 41,
    "contributors": 2,
    "automation_commits": 0,
    "insertions_raw": 5840,
    "deletions_raw": 9420,
    "net_loc_raw": -3580,
    "insertions_filtered": 5840,
    "deletions_filtered": 9420,
    "net_loc_filtered": -3580,
    "filter_note": "raw LOC includes lockfiles and autogenerated reports; filtered excludes lockfiles",
    "test_loc_insertions": 2850,
    "test_ratio_pct": 0.48,
    "feat_pct": 0.45,
    "fix_pct": 0.35,
    "docs_pct": 0.0,
    "chore_pct": 0.0,
    "test_pct": 0.0,
    "active_days": 7,
    "sessions": 12,
    "deep_sessions": 6,
    "peak_hour": 17,
    "late_night_commits_22_to_04": 0,
    "team_streak_days": 0,
    "personal_streak_days": 0,
    "backlog_open_todos": 0,
    "backlog_closed_this_period": 0,
    "version_range": [
      "v2.14.0",
      "v2.21.2"
    ],
    "release_commits": 0,
    "focus_area": "general"
  },
  "authors": {
    "Chris Sorensen": {
      "commits": 38,
      "role": "human",
      "insertions": 5800,
      "deletions": 9400,
      "test_ratio": 0.48,
      "top_area": "src/api/, cic-ingestion/, engines/"
    },
    "toolforge-release-bot": {
      "commits": 3,
      "role": "human",
      "insertions": 40,
      "deletions": 20,
      "test_ratio": 0.0,
      "top_area": "package.json"
    }
  },
  "session_focus": {
    "summary": "Week of Jul 20: 41 commits (2 contributors), 100% repo test suite passing, 1,513+ tests verified | Streak: 18d",
    "incidents": [],
    "process_learnings": []
  }
}