{
  "date": "2026-07-21",
  "window": "7d",
  "since": "2026-07-21T00:00:00-04:00",
  "until": "2026-07-21T23:59:59-04:00",
  "base_branch": "main",
  "prior_retro_baseline": ".context/retros/2026-07-21-1.json",
  "note": null,
  "metrics": {
    "commits": 294,
    "commits_no_merge": 294,
    "contributors": 2,
    "automation_commits": 1,
    "insertions_raw": 74365,
    "deletions_raw": 17053,
    "net_loc_raw": 57312,
    "insertions_filtered": 74365,
    "deletions_filtered": 17053,
    "net_loc_filtered": 57312,
    "filter_note": "raw LOC includes lockfiles and autogenerated reports; filtered excludes lockfiles",
    "test_loc_insertions": 0,
    "test_ratio_pct": 0.0,
    "feat_pct": 0.0,
    "fix_pct": 0.0,
    "docs_pct": 0.0,
    "chore_pct": 0.0,
    "test_pct": 0.0,
    "active_days": 11,
    "sessions": 0,
    "deep_sessions": 0,
    "peak_hour": 12,
    "late_night_commits_22_to_04": 0,
    "team_streak_days": 11,
    "personal_streak_days": 11,
    "backlog_open_todos": 0,
    "backlog_closed_this_period": 0,
    "version_range": [
      "v2.14.0",
      "v2.15.0"
    ],
    "release_commits": 1,
    "focus_area": "docs/meta/; scripts/; .context/"
  },
  "authors": {
    "toolforge-release-bot": {
      "commits": 1,
      "role": "automation"
    },
    "Chris Sorensen": {
      "commits": 293,
      "role": "human"
    }
  },
  "session_focus": {
    "summary": "Fixed LOC backfill for 2026-07-17-7.json retro file (git log --numstat aggregation). Created setup scripts for Windows Task Scheduler automation: setup-daily-report-schedule.ps1 (daily 6am, 1h timeout) and setup-weekly-report-schedule.ps1 (Monday 6am, 2h timeout). All 3 task setup scripts ready for admin registration: retro-audit (Sundays 6pm), daily-report (daily 6am), weekly-report (Monday 6am).",
    "incidents": [],
    "process_learnings": []
  }
}