{
  "date": "2026-07-26",
  "window": "7d",
  "since": "2026-07-26T00:00:00-04:00",
  "until": "2026-07-26T23:59:59-04:00",
  "base_branch": "main",
  "prior_retro_baseline": ".context/retros/2026-07-25-2.json",
  "note": null,
  "metrics": {
    "commits": 106,
    "commits_no_merge": 106,
    "contributors": 2,
    "automation_commits": 17,
    "insertions_raw": 29974,
    "deletions_raw": 8312,
    "net_loc_raw": 21662,
    "insertions_filtered": 29974,
    "deletions_filtered": 8312,
    "net_loc_filtered": 21662,
    "filter_note": "raw LOC includes lockfiles and autogenerated reports; filtered excludes lockfiles",
    "test_loc_insertions": 1487,
    "test_ratio_pct": 4.96,
    "feat_pct": 30.5,
    "fix_pct": 13.3,
    "docs_pct": 28.6,
    "chore_pct": 22.9,
    "test_pct": 0.0,
    "active_days": 6,
    "sessions": 4,
    "deep_sessions": 0,
    "peak_hour": 12,
    "late_night_commits_22_to_04": 0,
    "team_streak_days": 0,
    "personal_streak_days": 0,
    "backlog_open_todos": 0,
    "backlog_closed_this_period": 0,
    "version_range": [
      "2.18.0",
      "2.21.2"
    ],
    "release_commits": 17,
    "focus_area": "TRM ingest/curator pipeline, secret-scan security fix, skill migration, session state sync"
  },
  "authors": {
    "Chris Sorensen": {
      "commits": 89,
      "role": "human"
    },
    "toolforge-release-bot": {
      "commits": 17,
      "role": "automation"
    }
  },
  "session_focus": {
    "summary": "TRM ingest/curator pipeline, secret-scan security fix, skill migration, session state sync",
    "incidents": [],
    "process_learnings": [
      "Fixed sk- secret-scan word-boundary gap blocking task-<uuid>/desk-<id> paths (verified true positives still caught)",
      "TRM curator-decision-processor + research-questions skill + vision-first photo judgment shipped",
      "Installed missing better-sqlite3 dep in ijfw mcp-server, restored tier-promotion/wiki-compile after 6+ wks silent breakage",
      "6 releases shipped (v2.18.0 -> v2.21.2) via toolforge-release-bot"
    ]
  }
}