{
  "date": "2026-07-14",
  "window": "1d",
  "since": "2026-07-14T00:00:00-04:00",
  "until": "2026-07-14T23:59:59-04:00",
  "base_branch": "main",
  "prior_retro_baseline": ".context/retros/2026-07-12-2.json",
  "note": "First retro since 2026-07-12-2 baseline",
  "metrics": {
    "commits": 99,
    "commits_no_merge": 99,
    "contributors": 1,
    "automation_commits": 0,
    "insertions_raw": 132355,
    "deletions_raw": 9520,
    "net_loc_raw": 122835,
    "insertions_filtered": 132355,
    "deletions_filtered": 9520,
    "net_loc_filtered": 122835,
    "filter_note": "raw LOC includes lockfiles and autogenerated reports; filtered excludes lockfiles",
    "test_loc_insertions": 0,
    "test_ratio_pct": 0.0,
    "feat_pct": 0.23,
    "fix_pct": 0.14,
    "docs_pct": 0.22,
    "chore_pct": 0.18,
    "test_pct": 0.08,
    "active_days": 7,
    "sessions": 0,
    "deep_sessions": 0,
    "peak_hour": 12,
    "late_night_commits_22_to_04": 0,
    "team_streak_days": 0,
    "personal_streak_days": 0,
    "backlog_open_todos": 0,
    "backlog_closed_this_period": 0,
    "version_range": [
      "v1.0.0",
      "v1.0.0"
    ],
    "release_commits": 0,
    "focus_area": "general"
  },
  "authors": {
    "Chris Sorensen": {
      "commits": 99,
      "role": "human",
      "insertions": 132355,
      "deletions": 9520
    }
  },
  "session_focus": {
    "summary": "Routine development session",
    "incidents": [],
    "process_learnings": []
  }
}