{
  "date": "2026-07-17",
  "window": "1d",
  "since": "2026-07-17T00:00:00-04:00",
  "until": "2026-07-17T23:59:59-04:00",
  "base_branch": "main",
  "prior_retro_baseline": ".context/retros/2026-07-17-2.json",
  "note": null,
  "metrics": {
    "commits": 228,
    "commits_no_merge": 224,
    "contributors": 1,
    "automation_commits": 22,
    "insertions_raw": 199611,
    "deletions_raw": 12855,
    "net_loc_raw": 186756,
    "insertions_filtered": 80818,
    "deletions_filtered": 12855,
    "net_loc_filtered": 67963,
    "filter_note": "excludes package-lock.json/yarn.lock/pnpm-lock.yaml only",
    "test_loc_insertions": 0,
    "test_ratio_pct": 0.0,
    "feat_pct": 0.0,
    "fix_pct": 0.0,
    "docs_pct": 0.0,
    "chore_pct": 0.0,
    "test_pct": 0.0,
    "active_days": 8,
    "sessions": 46,
    "deep_sessions": 9,
    "peak_hour": 12,
    "late_night_commits_22_to_04": 0,
    "team_streak_days": 10,
    "personal_streak_days": 10,
    "backlog_open_todos": 5,
    "backlog_closed_this_period": 3,
    "version_range": [
      "v2.1.0",
      "v2.8.1"
    ],
    "release_commits": 22,
    "focus_area": "skills/"
  },
  "authors": {
    "Chris Sorensen": {
      "commits": 202,
      "role": "human"
    },
    "toolforge-release-bot": {
      "commits": 22,
      "role": "automation"
    }
  },
  "session_focus": {
    "summary": "This session: triaged 6 candidate global Claude Code skills for redundancy against gstack/toolforge, migrated 3 (session-wrap, skill-health-monitor, automation-audit) into toolforge/skills with deep-review rewrites, retired 3 broken/redundant ones. Registered 4 orphaned skill directories into manifest.json. Traced and fixed 6 real bugs in run-tool.ps1 (skill discovery/execution pipeline) plus the telemetry API's DB_PATH. Verified end-to-end with a real recorded skill run. Investigated and fixed a security-scanner FS-BINARY false-positive in both tracked copies of skill-security-auditor.py, after first trying (and correctly reverting) a file-rename approach that would have silently undone itself. Fixed two broken git hooks (pre-commit pwsh -File/.ps1 mismatch) blocking every commit in the toolforge repo. Closed out TODOS.md TorqueQuery hardening item and cleaned up scratch/stale files.",
    "incidents": [],
    "process_learnings": []
  }
}