{
  "date": "2026-08-02",
  "window": "7d",
  "since": "2026-07-26T00:00:00-04:00",
  "until": "2026-08-02T23:59:59-04:00",
  "base_branch": "main",
  "prior_retro_baseline": ".context/retros/2026-07-31-1.json",
  "note": "trm-vault work this week (Helene I/II yacht research, 3 topics, image-batch provenance) is invisible to this repo's git log by design (see memory/project-trm-vault-deliberately-local-only.md) -- retro undercounts real output same as flagged in prior retros. Also: discovered today that toolforge's own pre-commit auto-sync/validator hooks re-trigger themselves on every commit (regenerate timestamped SKILLPACK-*/dashboard.html/audit/* output each time), producing a churn loop -- visible in this window's hotspot list (9 touches each on 6 files) and worth fixing, not just noting again.",
  "metrics": {
    "commits": 93,
    "commits_no_merge": 83,
    "merge_commits": 10,
    "contributors": 2,
    "automation_commits": 22,
    "insertions_raw": 41881,
    "deletions_raw": 24397,
    "net_loc_raw": 17484,
    "insertions_filtered": 41881,
    "deletions_filtered": 24397,
    "net_loc_filtered": 17484,
    "filter_note": "Largest single commit (4f66345, 14.5k LOC, 07-26) is the same bulk-sync artifact flagged as a hotspot distortion in the prior two retros; not separately excluded from LOC totals, raw == filtered.",
    "bulk_sync_commit": "4f66345",
    "bulk_sync_hotspot_dir": "research-data/ (carried over from 07-26, inside this window)",
    "test_loc_insertions": 3830,
    "test_ratio_pct": 9.1,
    "commit_type_breakdown_human": { "chore": 34, "docs": 19, "feat": 15, "fix": 13, "merge_or_other": 12, "test": 2 },
    "feat_pct": 16.1,
    "fix_pct": 14.0,
    "docs_pct": 20.4,
    "chore_pct": 36.6,
    "test_pct": 2.2,
    "peak_hour": 21,
    "late_night_commits_22_to_04": 30,
    "focus_area": "governance/ (CIC-AI-AGENT-COST-SPEC runtime: RateCardManager, AtomicBudgetGate, CircuitBreakerEngine, EvidenceLogger, ScalingGateEvaluator) + repeated auto-sync/validator regen noise (SKILLPACK-*, dashboard.html, audit/*, 9 touches each)",
    "focus_area_excl_noise": "governance/ (CIC-AI-AGENT-COST-SPEC-001 runtime build, Antigravity + Claude both landing pieces)",
    "active_days": 8,
    "dark_day": null,
    "sessions": 22,
    "deep_sessions": 2,
    "medium_sessions": 0,
    "micro_sessions": 20,
    "total_active_minutes": 438,
    "peak_hours": ["21:00 (12 commits)", "22:00 (11)", "14:00 (8)"],
    "team_streak_days": 8,
    "personal_streak_days": 8,
    "streak_broken_by": null,
    "backlog_open_todos": 10,
    "backlog_closed_this_period": 4,
    "backlog_open_last_period": 10,
    "version_range": ["v2.26.0", "v2.30.1"],
    "release_commits": 22,
    "ship_of_the_week": {
      "hash": "cc6971b",
      "subject": "fix(security): remove word-boundary gap in sk- secret-scan pattern",
      "loc": 6833
    }
  },
  "authors": {
    "Chris Sorensen": { "commits": 71, "role": "human" },
    "toolforge-release-bot": { "commits": 22, "role": "automation" }
  },
  "session_focus": {
    "summary": "Governance-runtime week: RateCardManager, AtomicBudgetGate, CircuitBreakerEngine (7-tier precedence), EvidenceLogger, REPORT_ONLY ScalingGateEvaluator, standalone cost_gate_adapter CLI, lineage-lock concurrency fix -- Antigravity building against CIC-AI-AGENT-COST-SPEC-001 with Claude landing adjacent pieces (retro schema v1.0 migration + tests, secret-scan word-boundary fix, retro-sync hook work carried from last week). Separately: closed out Helene yacht TRM research end-to-end in trm-vault (invisible here) -- two distinct Sorensen yachts identified and disambiguated, 44-image batch processed, provenance confirmed with the user (Mark Sprang / BGSU Historical Collections of the Great Lakes). Also discovered and stopped (but did not yet fix) a self-triggering regen loop in the auto-sync/validator pre-commit hooks.",
    "incidents": [
      "Auto-sync/validator pre-commit hooks regenerate their own timestamped output (SKILLPACK-METADATA*, SKILLPACK-VALIDATION.md, SKILLPACK-RUNTIME-HEALTH.md, SKILLPACK-DEPENDENCY-GRAPH.md, dashboard.html, audit/COWORK-*) on every commit that touches nothing related to skills at all -- confirmed live today: 3 consecutive chore(sync) commits each triggered a fresh diff on the same 6-8 files. Not chased to convergence (would have committed indefinitely); stopped after 3 commits and flagged. This is the same set of files showing 9 touches each in this window's hotspot list -- a real bug, not incidental noise, and it inflates commit/LOC counts every week it goes unfixed.",
      "trm-vault has NO git remote by design -- confirmed today via its pre-push hook, which hard-refuses any push and says explicitly not to bypass it. User asked to add a remote and push; hook blocked it; user chose to respect the guardrail and had the remote removed. Corrected in TODOS.md (was previously mischaracterized as a plain oversight) and logged to memory so it isn't re-litigated blind next time this comes up.",
      "Backlog held flat at 10 open items despite 4 closes this period -- 4 new items opened at roughly the same rate items closed (Invoke-ToolforgeInstall node_modules copy bug, trm-vault remote reclassification, plus 2 from the prior week's schema/tsx gaps still open)."
    ],
    "process_learnings": [
      "A guardrail hook that explicitly tells you not to work around it is a stronger signal than a TODOS.md line calling the same thing 'missing' -- worth testing the actual mechanism before trusting a backlog item's framing, especially one that's a week old.",
      "Self-regenerating pre-commit output is a compounding cost: every unrelated commit this week paid a tax of 6-8 extra file diffs with no functional change. Left unfixed, next week's retro hotspot list will show the same files again for the same non-reason."
    ]
  }
}
