{
  "date": "2026-07-25",
  "window": "7d",
  "since": "2026-07-25T00:00:00-04:00",
  "until": "2026-07-25T23:59:59-04:00",
  "base_branch": "main",
  "prior_retro_baseline": ".context/retros/2026-07-25-1.json",
  "note": "Reconciled retro run using canonical test file pattern (**/*.test.*, **/*.spec.*, **/tests/*). Replaces prior partial scan (2026-07-25-1.json) which omitted sub-project test directories.",
  "metrics": {
    "commits": 146,
    "commits_no_merge": 140,
    "contributors": 2,
    "automation_commits": 23,
    "insertions_raw": 27687,
    "deletions_raw": 7267,
    "net_loc_raw": 20420,
    "insertions_filtered": 27687,
    "deletions_filtered": 7267,
    "net_loc_filtered": 20420,
    "filter_note": "raw LOC includes lockfiles and autogenerated reports; filtered excludes lockfiles",
    "test_loc_insertions": 1863,
    "test_ratio_pct": 6.7,
    "feat_pct": 26.2,
    "fix_pct": 11.3,
    "docs_pct": 35.5,
    "chore_pct": 21.3,
    "test_pct": 2.1,
    "active_days": 7,
    "sessions": 30,
    "deep_sessions": 8,
    "peak_hour": 22,
    "late_night_commits_22_to_04": 0,
    "team_streak_days": 17,
    "personal_streak_days": 17,
    "backlog_open_todos": 7,
    "backlog_closed_this_period": 0,
    "version_range": [
      "v2.8.5",
      "v2.21.0"
    ],
    "release_commits": 23,
    "focus_area": "TRM ingest pipeline maturation (scan-gaps.mjs, update-focus-areas.mjs, research-questions skill, vision-first photo judgment, CLI/Windows guard fix); daily/weekly reporting agent scaffold; skill-doc governance migration (Skill Operator Guide, waves A-C); roadmap consolidation + drift checker; CIC Vision Subsystem"
  },
  "authors": {
    "Chris Sorensen": {
      "commits": 117,
      "role": "human"
    },
    "toolforge-release-bot": {
      "commits": 23,
      "role": "automation"
    }
  },
  "session_focus": {
    "summary": "TRM ingest pipeline maturation (scan-gaps.mjs, update-focus-areas.mjs, research-questions skill, vision-first photo judgment, CLI/Windows guard fix); daily/weekly reporting agent scaffold; skill-doc governance migration (Skill Operator Guide, waves A-C); roadmap consolidation + drift checker; CIC Vision Subsystem",
    "incidents": [],
    "process_learnings": []
  }
}